CommentID,VideoID,VideoTitle,AuthorName,AuthorChannelID,CommentText,Sentiment,Likes,Replies,PublishedAt,CountryCode,CategoryID,comment_length,text_fr
UgwnepzbuXAQIDBpm394AaABAg,WtftZPL-k7Y,There Are Only 2 Genders | Change My Mind,@craigdownie4077,UCl6Q_dY8fJ_vRQA9MQyKGcg,People calling her by “her” and “she” when defending her. Literally stevens point,Neutral,4626,40,2021-07-02 03:38:18,US,25,81,Les gens l'appellent par . . . . . . . . . . . . . . . . . . . . . . . . . . . . . . . . . . . . . . . . . . . . . . . . . . . . . . . . . . . . . . . . . . . . . . . . . . . . . . . . . . . . . . . . . . . . . . . . . . . . . . . . . . . . . . . . . . . . . . . . . . . . . . . . . . . . . . . . . . . . . . . . . . . . . . . . . . . . . . . . . . . . . . . . . . . . . . . . . . . . . . . . . . . . . . . . . . . . . . . . . . . . . . . . . . . . . . . . . . . . . . . . . . . . . . . . . . . . . . . . . . . . . . . . . . . . . . . . . . . . . . . . . . . . . . . . . . . . . . . . . . . . . . . . . . . . . . . . . . . . . . . . . . . . . . . . . . . . . . . . . . . . . . . . . . . . . . . . . . . . . . . . . . . . . . . . . . . . . . . . . . . . . . . . . . . . . . . . . . . . . . . . . . . . . . . . . . . . . . . . . . . . . . . . . . . . . . . . . . . . . . . . . . . . . . . . . . . . . . . . . . . . . . . . . . . . . . . . . . . . . . . . . . . . . . . . . . . . . . . . . . . . . . . . . . . . . . . . . . . . . .
UgxZWg5VPdSv0pmmV8t4AaABAg,-D_6wWKA3Do,Testing World's BRIGHTEST Flashlight...,@Ko2274wisconsin,UCim4Chh4B3rmX2D-t7C6eZA,"Fakeeeeeeee!!!!!! #1 you can see a split second before he turns it in, another light to his left turns on first  #2 Its not that bright, i raccoon hunt and have a 2 mill candle watt spot light, and that shines as bright as you saw",Negative,0,0,2025-01-11 07:01:59,GB,28,230,"Fakeeeeeeeee!!!!!! #1 vous pouvez voir une fraction de seconde avant qu'il le tourne dedans, une autre lumière à sa gauche tourne sur la première #2 Son pas que lumineux, je chasse le raton laveur et ont une bougie de 2 moulin watt spot lumière, et qui brille aussi lumineux que vous avez vu"
Ugy_0C_4EUaNlr2Zg514AaABAg,qSRrxpdMpVc,React Native Tutorial for Beginners - Crash Course 2020,@juanbolasotodenicaragua4484,UC9XiKeZdpyC0ocUnf-GzRbg,"👍#22k
18:43
07-05-2023",Neutral,0,0,2023-05-08 00:42:25,DE,27,22,N°22k 18:43 07-05-2023
UgzmbuKGNxMj7wBJvoR4AaABAg,4DMaCH0YkMc,Opening & Testing 70 Year Old Fallout Shelter Water,@SillyGoober3417,UCd2CJkz5iEn_wgvZhvtSh-Q,Still water.,Neutral,12,0,2025-01-10 21:39:17,AU,26,12,Encore de l'eau.
UgxiJeGeL8cjA_q5LdJ4AaABAg_aug,rtXpYpZdOzM,"Repository Pattern with C# and Entity Framework, Done Right | Mosh",AugmentedUser,AugmentedCID,"I realize this is an older video but: you aimed to separate persistence from application logic. However, you're still passing EF entities to the application instead of using generic types or DTOs. Also, the Find(predicate) method directly exposes query logic. I much prefer the explicit methods you have, but they should only return the properties required for the business rules.",Negative,0,0,2025-02-02 14:04:28,AU,27,380,"Je me rends compte que c'est une vidéo plus ancienne mais : vous avez voulu séparer la persistance de la logique d'application. Cependant, vous passez toujours des entités EF à l'application au lieu d'utiliser des types génériques ou des DTO. De plus, la méthode Find(predicate) expose directement la logique de requête. Je préfère beaucoup les méthodes explicites que vous avez, mais elles ne devraient retourner que les propriétés requises pour les règles d'affaires... . . . . . . . . . . . . . . . . . . . . . . . . . . . . . . . . . . . . . . . . . . . . . . . . . . . . . . . . . . . . . . . . . . . . . . . . . . . . . . . . . . . . . . . . . . . . . . . . . . . . . . . . . . . . . . . . . . . . . . . . . . . . . . . . . . . . . . . . . . . . . . . . . . . . . . . . . . . . . . . . . . . . . . . . . . . . . . . . . . . . . . . . . . . . . . . . . . . . . . . . . . . . . . . . . . . . . . . . . . . . . . . . . . . . . . . . . . . . . . . . . . . . . . . . . . . . . . . . . . . . . . . . . . . . . . . . . . . . . . . . . . . . . . . . . . . . . . . . . . . . . . . . . . . . . . . . . . . . . . . . . . . . . . . . . . . . . . . . . . . . . . . . . . . . . . . . . . . . . . . . . . . . . . . . . . . . . . . . . . . . . . . . . . . . . . . . . . . . . . . . . . . . . . . ."
Ugy8EmDUA3kMmVvFUGt4AaABAg,sbDVU7d9V90,never disrespect your opponent! {@mma_fightspeed},@LivingDeadGirl0702,UCTbqroMW1eVIU53WO14oPqA,"In a version of this clip where there's no music you can hear the giant man-girl get all pissy n tell the little girl how ""i WaS tApPiNg! WhEn i TaP yOu StOp"".

He's just mad kus he can't fuckin fight.  🤣🤣",Negative,80,2,2025-01-03 14:11:26,US,17,205,"Dans une version de ce clip où il n'y a pas de musique, vous pouvez entendre la géante homme-fille obtenir tout pisse n dire à la petite fille comment ""i WaS tApPiNg! WhEn i TaP yOu StOp"". Il est juste fou kus qu'il ne peut pas se battre putain. . . . . . . . . . . . . . . . . . . . . . . . . . . . . . . . . . . . . . . . . . . . . . . . . . . . . . . . . . . . . . . . . . . . . . . . . . . . . . . . . . . . . . . . . . . . . . . . . . . . . . . . . . . . . . . . . . . . . . . . . . . . . . . . . . . . . . . . . . . . . . . . . . . . . . . . . . . . . . . . . . . . . . . . . . . . . . . . . . . . . . . . . . . . . . . . . . . . . . . . . . . . . . . . . . . . . . . . . . . . . . . . . . . . . . . . . . . . . . . . . . . . . . . . . . . . . . . . . . . . . . . . . . . . . . . . . . . . . . . . . . . . . . . . . . . . . . . . . . . . . . . . . . . . . . . . . . . . . . . . . . . . . . . . . . . . . . . . . . . . . . . . . . . . . . . . . . . . . . . . . . . . . . . . . . . . . . . . . . . . . . . . . . . . . . . . . . . . . . . . . . . . . . . . . . . . . . . . . . . . . . . . . . . . . . . . . . . ."
Ugwewcy73WxxLPmlJWR4AaABAg,3dESS7vZlH0,"a bear spent the entire day,searching for food, returns home to find that his wife has betrayed him!",@joedakid4901,UC1tVlJyEmcDwIzOoDJzOVRQ,Bro already got beat up for smacking another bears cheeks and getting caught buddy missing a whole chunk😂😂,Neutral,0,0,2025-01-15 11:43:57,NZ,15,106,Bro s'est déjà fait tabasser pour avoir cogné un autre ours joues et s'être fait attraper par un pote qui avait manqué un morceau entier de sa vie. . . . . . . . . . . . . . . . . . . . . . . . . . . . . . . . . . . . . . . . . . . . . . . . . . . . . . . . . . . . . . . . . . . . . . . . . . . . . . . . . . . . . . . . . . . . . . . . . . . . . . . . . . . . . . . . . . . . . . . . . . . . . . . . . . . . . . . . . . . . . . . . . . . . . . . . . . . . . . . . . . . . . . . . . . . . . . . . . . . . . . . . . . . . . . . . . . . . . . . . . . . . . . . . . . . . . . . . . . . . . . . . . . . . . . . . . . . . . . . . . . . . . . . . . . . . . . . . . . . . . . . . . . . . . . . . . . . . . . . . . . . . . . . . . . . . . . . . . . . . . . . . . . . . . . . . . . . . . . . . . . . . . . . . . . . . . . . . . . . . . . . . . . . . . . . . . . . . . . . . . . . . . . . . . . . . . . . . . . . . . . . . . . . . . . . . . . . . . . . . . . . . . . . . . . . . . . . . . . . . . . . . . . . . . . . . . . . . . . . . . . . . . . . . . . . . . . . . . . . . . . . . . . . . . . . . .
Ugxw5yjRo2lePD25rK54AaABAg,l6nmysZKHFU,ReactJS - Build a Responsive Navigation Bar & Side Drawer Tutorial,@innovaxion247,UCUpYI-HO8XTZI9rnld6DLNA,Wow so amazing! I really appreciate this tutorial. it's the best,Positive,1,0,2020-06-02 12:54:42,DE,27,64,Wow tellement incroyable! J'apprécie vraiment ce tutoriel. c'est le meilleur
UgwhNfxjL-VRsXJnNfd4AaABAg,CvyCNm0Qczg,ELON MUSK ATTACKS KYLE!,@toddh3704,UCmmMvIrskYWDYGbU_DwwQWw,That's a badge of honor. Wear it proud.,Positive,29,0,2024-12-20 22:07:26,US,25,39,C'est un insigne d'honneur.
UgzKIl-3MhHhSJKQFVh4AaABAg,BP7AEdI5W14,This Guy Broke an Egg but... 🐔,@Goku99-rx4vh,UChp7QD43tertERx31RigGsQ,That's not a chicken egg...,Negative,0,0,2025-01-13 17:27:20,AU,15,27,Ce n'est pas un œuf de poulet...
Ugxnm3WYl9PPsq5SknF4AaABAg,XZA9oqTZP38,#Cómo echar gasolina versión pro,@VasyaVasiliev-t3e,UC8gv5i8XHauWK6GjejXFR_A,Оплата терминалом😂,Neutral,0,0,2025-01-14 12:12:47,IE,26,18,"Il y a des gens qui ne savent pas ce qu'il y a de plus important dans la vie de l'enfant, mais qui ne savent pas ce qu'il y a de plus important dans la vie de l'enfant."
UgxT1_eFG3dFhtbnMOR4AaABAg,PuFxLaPiwDw,Nate Silver: Bloomberg is COLLAPSING!,@ericpgibb,UCUR4ltwXTWUWPP2C_WD6lXg,Does anyone turn these videos off the moment John is up? I think they need a better host. Cenk!,Negative,2,3,2020-02-29 12:43:37,US,25,95,Quelqu'un éteint ces vidéos au moment où John est debout ? Je pense qu'ils ont besoin d'un meilleur hôte. Cenk !
UgxcwthbUHNCqACgt-p4AaABAg,C7u7Hhh3V5I,this mom loved to do the most unique cake you’ll ever see ❤️,@iloverobux3631,UC30Qnzkeukrr2i0BfXm0J5A,Its a display cake for the store,Neutral,1,0,2025-01-10 20:45:18,CA,26,32,C'est un gâteau d'étalage pour le magasin
UgxhFxiCx0N9dZdPnGZ4AaABAg,pGwVJkRVzgg,EXPOSED: US DEFENDS Israel’s MURDER Of 5 Year Old Gazan | The Kyle Kulinski Show,@Izreal-Zeus,UCCMBjVjbIRHXX3W4scFumLQ,Get AIPAC out of politics.,Positive,1866,67,2024-11-28 19:49:34,US,25,26,Faites sortir AIPAC de la politique.
Ugz0MXdIK78FZsjvMQh4AaABAg,RRunwAI7N5Q,[1619] Drop Key Locks: A Different Approach,@GhostOfJulesVerne,UCQtQxGjv5bIUpdXIXB6ATTA,"My grandpa had a homemade lock on his fence gate that worked similar to this, but the latch was made out of wood.",Neutral,0,0,2025-01-13 00:26:46,AU,28,113,"Mon grand-père avait une serrure maison sur sa grille qui fonctionnait comme ça, mais la serrure était faite de bois."
UgzxjMY38jf8yyvlOHl4AaABAg,AgyTHzjBS-c,How much Coding to learn for Placements? Data Structure & Algorithms,@Krsvu,UCgxrz963A6g5dyqYInjblfg,Didi isme beginners ke liye roadmap bna dijiye DSA ka,Positive,0,0,2024-06-06 08:36:48,IN,27,53,Didi isme débutants ke liyae feuille de route bna dijiye DSA ka
Ugzjo3AIK3MPmZUpiZl4AaABAg,I9RkcSduI7g,How to Protect Your CCTV Camera From Hackers? (Educational),@salamatmaniyar,UCvjUwHeFG6Vb_nTQAhd400w,"practical part remove kar diya
🤦‍♂🤦‍♂🤦‍♂🤦‍♂🤦‍♂🤦‍♂🤦‍♂🤦‍♂",Negative,0,1,2024-02-11 15:17:01,IN,27,55,partie pratique enlever kar diya .. . . . . . . . . . . . . . . . . . . . . . . . . . . . . . . . . . . . . . . . . . . . . . . . . . . . . . . . . . . . . . . . . . . . . . . . . . . . . . . . . . . . . . . . . . . . . . . . . . . . . . . . . . . . . . . . . . . . . . . . . . . . . . . . . . . . . . . . . . . . . . . . . . . . . . . . . . . . . . . . . . . . . . . . . . . . . . . . . . . . . . . . . . . . . . . . . . . . . . . . . . . . . . . . . . . . . . . . . . . . . . . . . . . . . . . . . . . . . . . . . . . . . . . . . . . . . . . . . . . . . . . . . . . . . . . . . . . . . . . . . . . . . . . . . . . . . . . . . . . . . . . . . . . . . . . . . . . . . . . . . . . . . . . . . . . . . . . . . . . . . . . . . . . . . . . . . . . . . . . . . . . . . . . . . . . . . . . . . . . . . . . . . . . . . . . . . . . . . . . . . . . . . . . . . . . . . . . . . . . . . . . . . . . . . . . . . . . . . . . . . . . . . . . . . . . . . . . . . . . . . . . . . . . . . . . . . . . . . . . . . . . . . . . . . . . . . . . . . . . . .
Ugz7_wK4BSbmUGF856B4AaABAg,Wy9q22isx3U,Vue JS Crash Course (2019),@paulwest5398,UC0tdQlUS0rGJegQ5RKtogBA,"This was a great help to me in fact, but I got stuck at the very last moment.
I tried to add the Header component to all of the pages, but I can't see the component. In the browser, there is an error message as follows:
""[Vue warn]: Unknown custom element: <Header> - did you register the component correctly? For recursive components, make sure to provide the ""name"" option.
found in
---> <App> at src/App.vue
       <Root>""
Would you like to help with solving this problem?",Neutral,0,1,2020-12-30 02:13:28,US,27,475,"J'ai essayé d'ajouter le composant Header à toutes les pages, mais je ne peux pas voir le composant. Dans le navigateur, il y a un message d'erreur comme suit: «[Avertissement de vue]: Élément personnalisé inconnu: <Header> - avez-vous enregistré le composant correctement? Pour les composants récursifs, assurez-vous de fournir l'option ""nom"". trouvé dans ---> <App> à src/App.vue <Root>» Voulez-vous aider à résoudre ce problème?.. . . . . . . . . . . . . . . . . . . . . . . . . . . . . . . . . . . . . . . . . . . . . . . . . . . . . . . . . . . . . . . . . . . . . . . . . . . . . . . . . . . . . . . . . . . . . . . . . . . . . . . . . . . . . . . . . . . . . . . . . . . . . . . . . . . . . . . . . . . . . . . . . . . . . . . . . . . . . . . . . . . . . . . . . . . . . . . . . . . . . . . . . . . . . . . . . . . . . . . . . . . . . . . . . . . . . . . . . . . . . . . . . . . . . . . . . . . . . . . . . . . . . . . . . . . . . . . . . . . . . . . . . . . . . . . . . . . . . . . . . . . . . . . . . . . . . . . . . . . . . . . . . . . . . . . . . . . . . . . . . . . . . . . . . . . . . . . . . . . . . . . . . . . . . . . . . . . . . . . . . . . . . . . . . . . . . . . . . . . . . . . . . . . . . . . . . . ."
Ugz2_S1MO9J-QnDawWB4AaABAg,SyHZd-w6spA,this one was impossible... #gaming #⁠youtube #funny #minecraft #memes #tiktok #shorts #ytshorts,@ETA-4LN,UCkAmYuhPO-vcmbVNFoXwXQg,0:02 WHERE,Neutral,0,0,2025-01-14 23:42:12,IE,20,10,0:02 OÙ
UgxqIl4Wk4V8qimwwBp4AaABAg,9lkQUS2bPCY,3 Best Websites for College Students,@RKSTUDIO2020,UCRUqhqjsAGo_7Ppf7DLwwcw,Sex wex Kiya Karo kabhi kya always tech teaching,Negative,0,0,2024-06-23 15:05:31,IN,27,48,Sexe wex Kiya Karo kabhi kya toujours enseignement technique
UgznV2w7pjP8etMB_n14AaABAg_aug,ykpuyNy5oUM,#3 Django tutorials | First App in Django - part 1,AugmentedUser,AugmentedCID,I'm unable to activate my virtual environment in VS Code.,Negative,0,0,2025-02-02 15:19:00,IN,27,57,Je ne peux pas activer mon environnement virtuel dans VS Code.
UgyVWjhjTB7OUWJMrdN4AaABAg,ORCdseWgR7M,"Hamas' Big Response To Trump's 'Hell' Threat, Jan 20 Deadline For Gaza Demand | Israel | Hostages",@Mike-r5e8h,UC-yzLmifHxJKCWHnJtryUog,Steve is a real-estate developer,Neutral,0,0,2025-01-12 01:04:14,CA,25,32,Steve est un développeur immobilier
UgwF2QtiOwHo9p9BH0h4AaABAg,1bgyNOY-ZPI,Amazing Impossible Christmas Gift Wrapping 🎁❤️ #shorts,@JJSTN666,UCaWCYn6qypAQkSdTS7wRnmg,Dude i think you might be colorblind😂,Negative,0,0,2025-01-11 21:48:13,GB,26,37,"Mec, je pense que tu es peut-être aveugle de couleur.. .. . . . . . . . . . . . . . . . . . . . . . . . . . . . . . . . . . . . . . . . . . . . . . . . . . . . . . . . . . . . . . . . . . . . . . . . . . . . . . . . . . . . . . . . . . . . . . . . . . . . . . . . . . . . . . . . . . . . . . . . . . . . . . . . . . . . . . . . . . . . . . . . . . . . . . . . . . . . . . . . . . . . . . . . . . . . . . . . . . . . . . . . . . . . . . . . . . . . . . . . . . . . . . . . . . . . . . . . . . . . . . . . . . . . . . . . . . . . . . . . . . . . . . . . . . . . . . . . . . . . . . . . . . . . . . . . . . . . . . . . . . . . . . . . . . . . . . . . . . . . . . . . . . . . . . . . . . . . . . . . . . . . . . . . . . . . . . . . . . . . . . . . . . . . . . . . . . . . . . . . . . . . . . . . . . . . . . . . . . . . . . . . . . . . . . . . . . . . . . . . . . . . . . . . . . . . . . . . . . . . . . . . . . . . . . . . . . . . . . . . . . . . . . . . . . . . . . . . . . . . . . . . . . . . . . . . . . . . . . . . . . . . . . . . . . . . . ."
UgxyjWvl-vfD8O3s2zN4AaABAg,MIj2liaAwt4,Disney's woke agenda revealed in leaked audio,@justjonow4553,UC_3WX1OMCxNjGEb5iGcjkiQ,No more Disney in my home,Positive,1,0,2023-03-20 22:54:14,CA,25,25,Plus de Disney chez moi.
UgwOn0i_uYRLWQ239BZ4AaABAg,-L2o02EhjHA,OFFICIAL TRAILER | Debunked. Season 2 with Ben Shapiro,@sammy_dee,UCQcuJ9khFqVGF9yi_dp97Ew,As a mathematician of physicist! 😂😂😂 Love what you doing Ben... keep it up 💪,Positive,8,0,2022-04-25 16:47:31,US,25,76,En tant que mathématicien du physicien! -Aimez ce que vous faites Ben... gardez-le jusqu'à ---------------------------------------------------------------------------------------------------------------------------------------------------------------------------------------------------------------------------------------------------------------------------------------------------------------------------------------------------------------------------------------------------------------------------------------------------------------------------------------------
UgyjPfLJCIojYll01514AaABAg_aug,xrMppTpoqdw,Learn Binary Search in 10 minutes 🪓,AugmentedUser,AugmentedCID,can this method be applied to an unsorted array?,Negative,0,0,2025-02-02 12:06:57,CA,27,48,Cette méthode peut-elle être appliquée à un tableau non trié ?
UgwwSciR22QszmEcyYN4AaABAg,p5TgPbOZBpg,Homes still bursting into flames in LA days after the initial fire passed through,@kellygreen8333,UCCI716k1nKdSzPbUyStBJ_Q,This is God warning. We must repent.,Neutral,7,2,2025-01-11 06:56:37,AU,25,36,C'est la mise en garde de Dieu. Nous devons nous repentir . . . . . . . . . . . . . . . . . . . . . . . . . . . . . . . . . . . . . . . . . . . . . . . . . . . . . . . . . . . . . . . . . . . . . . . . . . . . . . . . . . . . . . . . . . . . . . . . . . . . . . . . . . . . . . . . . . . . . . . . . . . . . . . . . . . . . . . . . . . . . . . . . . . . . . . . . . . . . . . . . . . . . . . . . . . . . . . . . . . . . . . . . . . . . . . . . . . . . . . . . . . . . . . . . . . . . . . . . . . . . . . . . . . . . . . . . . . . . . . . . . . . . . . . . . . . . . . . . . . . . . . . . . . . . . . . . . . . . . . . . . . . . . . . . . . . . . . . . . . . . . . . . . . . . . . . . . . . . . . . . . . . . . . . . . . . . . . . . . . . . . . . . . . . . . . . . . . . . . . . . . . . . . . . . . . . . . . . . . . . . . . . . . . . . . . . . . . . . . . . . . . . . . . . . . . . . . . . . . . . . . . . . . . . . . . . . . . . . . . . . . . . . . . . . . . . . . . . . . . . . . . . . . . . . . . . . . . . . . . . . . . . . . . . . . . . . . . .
UgwG3Lip3sW6XsO2qyV4AaABAg_aug,dKGspXaxkhc,insane TF2 item,AugmentedUser,AugmentedCID,That's very gay.,Negative,0,0,2025-02-04 03:27:12,IE,20,16,C'est très gay.
Ugwa8Jju2vLYqdnuTeF4AaABAg,QF2abxA-w1I,Losing my favourite job on the farm #farming,@Jay-sux,UC6EAJLivDsMXlUaniiJkFyg,Meh that potato is pretty small,Neutral,0,0,2025-01-14 22:51:51,NZ,26,31,Meh que la pomme de terre est assez petite
UgwHMcRTeugBeRTKaGF4AaABAg_aug,Bxdt6T_1qgc,Coding Challenge 181: Weighted Voronoi Stippling,AugmentedUser,AugmentedCID,Could someone please guide me on how to export the final stippling as an SVG file? I'm not a programmer! Thanks!,Neutral,0,0,2025-02-04 23:34:09,US,27,112,Quelqu'un pourrait-il me guider sur la façon d'exporter le stippling final comme un fichier SVG? Je ne suis pas un programmeur! Merci!
Ugw5QQIJTMslex448Ft4AaABAg,3hOyi75x8Sw,The Most Ridiculous Children's Book Ever Written,@davidburkhart9659,UC-FZYAK1VZO44DieCUOfurA,"“If a four year old had the body of a forty year old, the world would be over.” That explains the Universities.",Negative,181,1,2020-11-15 01:01:12,US,25,111,"Si un enfant de quatre ans avait le corps d'un enfant de quarante ans, le monde serait fini. , ça explique les universités. , . . . . . . . . . . . . . . . . . . . . . . . . . . . . . . . . . . . . . . . . . . . . . . . . . . . . . . . . . . . . . . . . . . . . . . . . . . . . . . . . . . . . . . . . . . . . . . . . . . . . . . . . . . . . . . . . . . . . . . . . . . . . . . . . . . . . . . . . . . . . . . . . . . . . . . . . . . . . . . . . . . . . . . . . . . . . . . . . . . . . . . . . . . . . . . . . . . . . . . . . . . . . . . . . . . . . . . . . . . . . . . . . . . . . . . . . . . . . . . . . . . . . . . . . . . . . . . . . . . . . . . . . . . . . . . . . . . . . . . . . . . . . . . . . . . . . . . . . . . . . . . . . . . . . . . . . . . . . . . . . . . . . . . . . . . . . . . . . . . . . . . . . . . . . . . . . . . . . . . . . . . . . . . . . . . . . . . . . . . . . . . . . . . . . . . . . . . . . . . . . . . . . . . . . . . . . . . . . . . . . . . . . . . . . . . . . . . . . . . . . . . . . . . . . . . . . . . . . . . . . . . . . . . . . . . . . . . . . . . ."
UgxzvTH0eT9rSx8tuE54AaABAg,Ec_oHVmgbYg,The Most Desperate Dog Dinner Request Ever,@dustinlarkin8582,UC1rEu_6ub50AArmH7GNQLXA,He said bet I will!,Neutral,0,0,2025-01-15 00:51:48,NZ,15,19,Il a dit que je le ferais !
Ugx-1dzHP6fhvMP-L8V4AaABAg,onfIWbRumx0,"California Wildfires, Gulf of America, Zuckerberg Kills Meta Fact-Checking | PBD Podcast | Ep. 530",@rosannetaylor4405,UCetV928ZzA9zlPuRXwtZz-Q,"Bill Gates reinvented himself, but he's still a spineless snake. He gives me the willies, I wouldn't trust him around Gertrude, my garden gnome.",Negative,0,0,2025-01-10 04:33:56,US,25,144,"Bill Gates s'est réinventé, mais il est toujours un serpent sans épines. Il me donne les volontés, je ne lui ferais pas confiance autour de Gertrude, mon gnome de jardin."
UgzhnBXUjVNJQI_9CJB4AaABAg,tYknAxW937E,Trump LAUGHED AT by Judge,@rachelrogers6795,UCiiLNm9hq0AYKwd55sx6kZw,Lock him up.,Positive,4,0,2019-10-11 09:25:15,US,25,12,Enfermez-le.
Ugw9TmYrfNHs84xVUV14AaABAg,X4qBFlnu7ec,Lil bro shocked the entire basketball stadium 😧,@JacquelineLoper,UCrPqKccwOSY7O4Aqox2c_rQ,He pissed😂,Neutral,0,0,2025-01-13 19:03:09,AU,17,10,Il s'est énervé.
UgzDmMoB7yO7J6-bI1F4AaABAg,i5K7oXtXfzM,He Worked For 12 Years To Win An Olympic Gold Medal.. 😱🏅,@GhostVook,UCNF3x1R4smsSRbKtCaRj4mA,"Morel of the story ❤❤
Never give up 🎉",Positive,2,0,2025-01-13 23:09:42,AU,17,37,Morel de l'histoire N'abandonnez jamais .. . . . . . . . . . . . . . . . . . . . . . . . . . . . . . . . . . . . . . . . . . . . . . . . . . . . . . . . . . . . . . . . . . . . . . . . . . . . . . . . . . . . . . . . . . . . . . . . . . . . . . . . . . . . . . . . . . . . . . . . . . . . . . . . . . . . . . . . . . . . . . . . . . . . . . . . . . . . . . . . . . . . . . . . . . . . . . . . . . . . . . . . . . . . . . . . . . . . . . . . . . . . . . . . . . . . . . . . . . . . . . . . . . . . . . . . . . . . . . . . . . . . . . . . . . . . . . . . . . . . . . . . . . . . . . . . . . . . . . . . . . . . . . . . . . . . . . . . . . . . . . . . . . . . . . . . . . . . . . . . . . . . . . . . . . . . . . . . . . . . . . . . . . . . . . . . . . . . . . . . . . . . . . . . . . . . . . . . . . . . . . . . . . . . . . . . . . . . . . . . . . . . . . . . . . . . . . . . . . . . . . . . . . . . . . . . . . . . . . . . . . . . . . . . . . . . . . . . . . . . . . . . . . . . . . . . . . . . . . . . . . . . . . . . . . . . . . . . .
UgyqutQDnutEYCD5fzV4AaABAg,plFzgNmPKRs,"""Disgusting!"" Fed up Fox anchor shreds LA wildfire LIES",@soniafaye9919,UCSJ7AV7gyOTp7x7bRNpeWRQ,maybe arsonists are destroying evidence (who are the celebs who've left the country as they get implicated in the diddy scandal?),Negative,0,0,2025-01-13 04:22:26,AU,25,129,Peut-être les pyromanes détruisent-ils des preuves (qui sont les célébrités qui ont quitté le pays alors qu'ils sont impliqués dans le scandale diddy?) . . . . . . . . . . . . . . . . . . . . . . . . . . . . . . . . . . . . . . . . . . . . . . . . . . . . . . . . . . . . . . . . . . . . . . . . . . . . . . . . . . . . . . . . . . . . . . . . . . . . . . . . . . . . . . . . . . . . . . . . . . . . . . . . . . . . . . . . . . . . . . . . . . . . . . . . . . . . . . . . . . . . . . . . . . . . . . . . . . . . . . . . . . . . . . . . . . . . . . . . . . . . . . . . . . . . . . . . . . . . . . . . . . . . . . . . . . . . . . . . . . . . . . . . . . . . . . . . . . . . . . . . . . . . . . . . . . . . . . . . . . . . . . . . . . . . . . . . . . . . . . . . . . . . . . . . . . . . . . . . . . . . . . . . . . . . . . . . . . . . . . . . . . . . . . . . . . . . . . . . . . . . . . . . . . . . . . . . . . . . . . . . . . . . . . . . . . . . . . . . . . . . . . . . . . . . . . . . . . . . . . . . . . . . . . . . . . . . . . . . . . . . . . . . . . . . . . . . . . . . . . . . . . . . . . . .
UgxmVY_mK-MNXaHRDxl4AaABAg,-N6HG9FhggM,Starmer Publicly DESTROYED By Quitting MP in Brutal TV Interview!,@jacquelinemonaghan5263,UCs_zfY8a-ghBec3mEJZX4QQ,WEF Puppet,Negative,0,0,2025-01-10 13:12:25,GB,25,10,Marionnette WEF
UgxGLMtgobWRxzOhk8h4AaABAg,TeZdo8mx0gc,HTML Tutorial: Installing VS Code & Live Server | Web Development Tutorials #2,@AmeerHamza-oe1dm,UCROjf_OYpL4tP-PYAuAbj5Q,"@_Code With Harry
Bro vscode android phone pe open ho skta hy yaaa ni ??????",Neutral,3,0,2024-01-03 13:46:47,IN,27,76,@_Code Avec Harry Bro vscode android phone pe open ho skta hy yaaa ni ?????
Ugw1z6p4wSbkHF30bRx4AaABAg,Qf2bV3USmOs,Ferrari Purosangue 1800-mile review. How does it cope on a family ski trip to the Alps?,@howarddavies136,UCTmKP4_ftT2KTRPjRsK-XzA,The FF was 11 years ago!?😳,Neutral,24,0,2025-01-12 17:17:06,IE,2,26,Le FF c'était il y a 11 ans !?==?=?=?===========================================================================================================================================================================================================================================================================================================================================================================================================================================================================================================
