CommentID,VideoID,VideoTitle,AuthorName,AuthorChannelID,CommentText,Sentiment,Likes,Replies,PublishedAt,CountryCode,CategoryID,comment_length,text_fr
Ugz7D6YQbtpb61ycd4R4AaABAg_aug,RuhGv81tpoU,C# interfaces 🐟,AugmentedUser,AugmentedCID,"I am a bit confused. What is the difference between the interface method and what was declared inside of the class, and how exactly does the interface come into play if we declare the same function inside of the class?",Negative,0,0,2025-02-02 11:48:42,CA,27,218,"Je suis un peu confus. Quelle est la différence entre la méthode d'interface et ce qui a été déclaré à l'intérieur de la classe, et comment exactement l'interface entre en jeu si nous déclarons la même fonction à l'intérieur de la classe ?"
Ugw9M7rW4EzWXvneGGZ4AaABAg,Yn4XzbMf9nY,Whistlindiesel Cybertruck Durability Test #2,@edixon5417,UCvMuEjej_w-YMZDwS4UP2hQ,how does one work for whistling diesel 🤔,Neutral,0,0,2025-01-11 19:05:14,GB,2,40,comment fonctionne-t-on pour siffler le diesel - - - - - - - - - - - - - - - - - - - - - - - - - - - - - - - - - - - - - - - - - - - - - - - - - - - - - - - - - - - - - - - - - - - - - - - - - - - - - - - - - - - - - - - - - - - - - - - - - - - - - - - - - - - - - - - - - - - - - -
Ugxed7cT8v1bp4eFWpN4AaABAg,FqSnGCDfaxw,PS4 Pro For $3 at Flea Market #shorts,@nerimansahin270,UCNproRWLAcv16PLCxuEeBpw,I Cry,Negative,0,0,2025-01-12 08:59:05,AU,28,5,Je pleure
UgwuJxNFZgNx8yFQxH54AaABAg,qc2OHUmIUEc,The Time Bill Belichick Took Away Matt Light's Hunting Season 😂. #nfl #billbelichick #patriots,@topnotchballer15,UCzgpsNBha_NENQ17krZTGuA,😂😂😂this actually tells me a lot,Positive,0,0,2025-01-05 17:49:35,US,17,31,Ça me dit beaucoup de choses.
UgztbqE5QLTCoTYl6-N4AaABAg,g12ioT-emGQ,Tallest Player in Squid Game in DEEP Trouble #shorts,@Luckyblxy,UC2yy3ajZ9Lw9MbglKmWbOIQ,IT NO DEEP TROUBLE IT WATER,Negative,0,0,2025-01-12 09:14:15,CA,24,27,Il ne faut pas faire tourner l'eau.
UgwPQYKR0hYTliHie8N4AaABAg,pQMnh_YuKsA,This BROKE him..,@NVHEdits,UC4mdIYhtNSQubCi3QE8Yd_A,"The song is ""La clé des champs"" by NTO",Neutral,26,7,2025-01-08 05:58:11,AU,17,38,"La chanson est ""La clé des champs"" de NTO"
UgyXQkkrz_S5P7fIest4AaABAg,-3alS4ETaBw,The F1 drama between Lewis Hamilton and Max Verstappen explained - BBC News,@NYRFAN75,UCiLKLM8igYvMIbGD2dnVvYw,I wholeheartedly believe the FIA rigged it for Max. The FIA and F1 knew if Lewis won his 8th he’d retire. They couldn’t let their cash cow go without having another in place. If Hamilton won and retired Max would take over no question but he never would have beaten one of the bests. This comes down to politics and cash. Lewis was robbed.,Negative,5,0,2024-03-03 14:06:40,GB,25,339,Je crois de tout cœur que la FIA l'a truquée pour Max. La FIA et F1 savaient si Lewis avait gagné sa 8e retraite. Ils ne pouvaient pas laisser leur vache de caisse partir sans en avoir une autre en place. Si Hamilton a gagné et a pris sa retraite Max ne prendrait pas en charge aucune question mais il n'aurait jamais battu l'un des meilleurs. Cela revient à la politique et à l'argent. Lewis a été volé... . . . . . . . . . . . . . . . . . . . . . . . . . . . . . . . . . . . . . . . . . . . . . . . . . . . . . . . . . . . . . . . . . . . . . . . . . . . . . . . . . . . . . . . . . . . . . . . . . . . . . . . . . . . . . . . . . . . . . . . . . . . . . . . . . . . . . . . . . . . . . . . . . . . . . . . . . . . . . . . . . . . . . . . . . . . . . . . . . . . . . . . . . . . . . . . . . . . . . . . . . . . . . . . . . . . . . . . . . . . . . . . . . . . . . . . . . . . . . . . . . . . . . . . . . . . . . . . . . . . . . . . . . . . . . . . . . . . . . . . . . . . . . . . . . . . . . . . . . . . . . . . . . . . . . . . . . . . . . . . . . . . . . . . . . . . . . . . . . . . . . . . . . . . . . . . . . . . . . . . . . . . . . . . . . . . . . . . . . . . . . . . . . . . . . . . . . . . . . . . . . . . . . . . . . . . . .
UgzSgbTBYkCYM8PA1D14AaABAg_aug,RFJlV__WbKw,Tesla's cars went crazy😱😳,AugmentedUser,AugmentedCID,"Self-driving cars represent the most insane concept of the century. Anyone with 30-40 years of professional experience in IT who has encountered the ""Blue Screen of Death"" understands this perfectly (and don't even get me started on those like myself who spent years in high-end electronics dealing with glitches, crosstalk, and signal integrity problems).",Negative,0,0,2025-02-04 14:11:54,US,2,356,"Les voitures auto-conduites représentent le concept le plus fou du siècle. Quiconque a 30-40 ans d'expérience professionnelle dans l'informatique qui a rencontré le « écran bleu de la mort » comprend parfaitement cela (et ne me faites même pas commencer sur ceux comme moi qui ont passé des années en électronique haut de gamme traitant des problèmes de glissades, de crosstalk, et d'intégrité du signal.) . . . . . . . . . . . . . . . . . . . . . . . . . . . . . . . . . . . . . . . . . . . . . . . . . . . . . . . . . . . . . . . . . . . . . . . . . . . . . . . . . . . . . . . . . . . . . . . . . . . . . . . . . . . . . . . . . . . . . . . . . . . . . . . . . . . . . . . . . . . . . . . . . . . . . . . . . . . . . . . . . . . . . . . . . . . . . . . . . . . . . . . . . . . . . . . . . . . . . . . . . . . . . . . . . . . . . . . . . . . . . . . . . . . . . . . . . . . . . . . . . . . . . . . . . . . . . . . . . . . . . . . . . . . . . . . . . . . . . . . . . . . . . . . . . . . . . . . . . . . . . . . . . . . . . . . . . . . . . . . . . . . . . . . . . . . . . . . . . . . . . . . . . . . . . . . . . . . . . . . . . . . . . . . . . . . . . . . . . . . . . . . . . . . . . . . . . . . . . . . . . . . . . . . . . . . . . . . . . . . . ."
UgzX7rC7SxyuVpCToSB4AaABAg,Vde5SH8e1OQ,PyQt5 Tutorial - Setup and a Basic GUI Application,@NannaDossa,UCYq_QgcdxRhutucw7vHkAsw,tq,Positive,0,0,2024-08-10 06:42:55,US,27,2,tq tq tq tq tq tq tq tq tq tq tq tq tq tq tq tq tq tq tq tq tq tq tq tq tq tq tq tq tq tq tq tq tq tq tq tw tw tw tw tw tw tw tw tw tw tw tw tw tw tw tw tw tw tw tw tw tw tw tw tw tw tw tw tw tw tw tw tw tw tw tw tw tw tw tw tw tw tw tw tw tw tw tw tw tw tw tw tw tw tw tw tw tw tw tw tw tw tw tw tw tw tw tw tw tw tw tw tw tw tw tw tw tw tw tw tw tw tw tw tw tw tw tw tw tw tw tw tw tw tw tw
UgxNu718dr6q3jtJ8_d4AaABAg,BnYWx2Ozahk,"Ben Shapiro REACTS To The ""2000 Mules"" Documentary",@raeb5226,UCwtvVxVyLQQUUGQYmvlirsg,"There was more than cell phone data, there was video of the people who had these cell phones while they were at the drop boxes . . .",Positive,0,0,2023-05-14 23:57:44,US,25,132,"Il y avait plus que les données du téléphone cellulaire, il y avait la vidéo des gens qui avaient ces téléphones cellulaires pendant qu'ils étaient dans les boîtes de dépôt . . . . . . . . . . . . . . . . . . . . . . . . . . . . . . . . . . . . . . . . . . . . . . . . . . . . . . . . . . . . . . . . . . . . . . . . . . . . . . . . . . . . . . . . . . . . . . . . . . . . . . . . . . . . . . . . . . . . . . . . . . . . . . . . . . . . . . . . . . . . . . . . . . . . . . . . . . . . . . . . . . . . . . . . . . . . . . . . . . . . . . . . . . . . . . . . . . . . . . . . . . . . . . . . . . . . . . . . . . . . . . . . . . . . . . . . . . . . . . . . . . . . . . . . . . . . . . . . . . . . . . . . . . . . . . . . . . . . . . . . . . . . . . . . . . . . . . . . . . . . . . . . . . . . . . . . . . . . . . . . . . . . . . . . . . . . . . . . . . . . . . . . . . . . . . . . . . . . . . . . . . . . . . . . . . . . . . . . . . . . . . . . . . . . . . . . . . . . . . . . . . . . . . . . . . . . . . . . . . . . . . . . . . . . . . . . . . . . . . . . . . . . . . . . . . . . . . . . . . . . . . . . . . . . . . . . . . . . ."
UgzI_hMQJ_lpthBnntx4AaABAg,myPFXZPNidg,I didn't Think This Was Possible (@driving_lessons),@roryerasmus1092,UC0IBGpzS9FKpZoZSj669D0g,Experience,Neutral,0,0,2025-01-11 15:52:48,CA,17,10,Expérience
Ugxn1tp7xboeaSBOrS54AaABAg,u4n1oML97sE,The Mystery of the Missing Child: What Was the Catfish Hiding?#animals #wildlife #foryou,@sizedjoker2353,UCgxbVt5GCwVi0c_ZBwyy2Og,Thats a big ass fish,Neutral,1,0,2025-01-07 07:24:56,AU,15,20,C'est un gros cul de poisson
Ugyv7DDfUp90g_8tFfV4AaABAg,K1Vw531gZKk,CROWDER CONFRONTS: Convicted Antifa Thug! | Louder with Crowder,@christopherweber9464,UC1qWw6tHc3wKZf9Xmu1eA1w,"@6:40 Define fascist, define woman, define insurrection.",Neutral,0,0,2024-03-14 11:17:25,US,25,56,"@6:40 Définissez le fasciste, définissez la femme, définissez l'insurrection."
UgwRVwtmBRRi3kpuSfF4AaABAg,dG4iuv_9ekg,What to do in a Bear Attack!,@DonstaEscobar,UC09w8LUA_0GaA-LyjtZ2_Mg,One bottle isn't enough always take 10 of those in case lol,Neutral,0,0,2025-01-07 15:46:26,US,15,59,Une bouteille ne suffit pas toujours en prendre 10 au cas où lol
UgzpTSDY7kw9TU40uD94AaABAg,3YMpm6papBY,Platinum Jubilee: How the first day with the Queen and Royal Family unfolded,@mariagustafson1633,UCtM7TfKBqxEDn5KVQLxYoLA,I love the horses and marching 🇺🇸🇺🇸🇺🇸🇺🇸👍👍👍👍❤️❤️❤️❤️❤️,Positive,14,0,2022-06-02 23:16:11,GB,25,53,J'aime les chevaux et les marches.. . . . . . . . . . . . . . . . . . . . . . . . . . . . . . . . . . . . . . . . . . . . . . . . . . . . . . . . . . . . . . . . . . . . . . . . . . . . . . . . . . . . . . . . . . . . . . . . . . . . . . . . . . . . . . . . . . . . . . . . . . . . . . . . . . . . . . . . . . . . . . . . . . . . . . . . . . . . . . . . . . . . . . . . . . . . . . . . . . . . . . . . . . . . . . . . . . . . . . . . . . . . . . . . . . . . . . . . . . . . . . . . . . . . . . . . . . . . . . . . . . . . . . . . . . . . . . . . . . . . . . . . . . . . . . . . . . . . . . . . . . . . . . . . . . . . . . . . . . . . . . . . . . . . . . . . . . . . . . . . . . . . . . . . . . . . . . . . . . . . . . . . . . . . . . . . . . . . . . . . . . . . . . . . . . . . . . . . . . . . . . . . . . . . . . . . . . . . . . . . . . . . . . . . . . . . . . . . . . . . . . . . . . . . . . . . . . . . . . . . . . . . . . . . . . . . . . . . . . . . . . . . . . . . . . . . . . . . . . . . . . . . . . . . . . . . . . . . . . . .
UgzU_sZhF3FkBhAlkAd4AaABAg,QPBygqSXq-c,120 year old Sichuan pickles (paocai),@titobobby5511,UCIqlIRvMuA3vIjc7FHN58-g,I love you for taking care of her. Thank you ❤,Positive,2,0,2025-01-10 02:22:55,US,26,46,Je t'aime d'avoir pris soin d'elle.
Ugw3Z0qSuTGl0qzMCVx4AaABAg,VSsvHDB2cZI,성공 vs 실패?! 오징어게임2 원조 달고나 - Success vs Failure?!  Do You Want to Play Squid Game 2? - Dalgona,@HumbertoMorales-c6f,UCb8sFzhgUHeS060WdlitYHA,Yo pensando que era la canción del chavo del ocho.,Neutral,0,0,2025-01-15 01:59:38,NZ,26,50,Yo pensando que era la canción del chavo del ocho.
UgyBuRAwtg42J4aRrGB4AaABAg,lqh0frLj54w,I know exactly what he’s saying 😂,@Quadraginta1337,UCArE-IvVuuKPEsaUasTGqUA,"All I understood was ‘cabayo’ 

马",Neutral,0,0,2025-01-10 21:44:08,US,15,33,"Tout ce que j'ai compris, c'était ""cabayo"""
UgxwDQLh_jwKbvIxSFp4AaABAg,h69Dx0oqNPU,Bách phát bách trớt [BEN EAGLE] #beneagle #training #kungfu #martialarts #fighting,@JamesOzinCandelario-i9l,UCq87yiHZ_fRPCfhWK_tqm9A,Bro😂,Neutral,0,0,2025-01-15 10:05:59,NZ,1,4,"C'est pas vrai, c'est pas vrai, c'est pas vrai, c'est pas vrai, c'est pas vrai, c'est pas vrai, c'est pas vrai, c'est pas vrai, c'est pas vrai, c'est pas vrai, c'est pas vrai, c'est pas vrai, c'est pas vrai, c'est pas vrai, c'est pas vrai, c'est pas vrai, c'est pas vrai, c'est pas vrai, c'est pas vrai, c'est pas vrai, c'est pas vrai, c'est pas vrai, c'est pas vrai, c'est pas vrai, c'est pas vrai, c'est pas vrai, c'est pas vrai ?"
UgzA0RefFjJdkg5Le4F4AaABAg_aug,i0Z6u125PZg,Nissan Is Fighting To Survive But Its Future Looks Grim,AugmentedUser,AugmentedCID,"There are too many car brands now. The economy is collapsing, and people aren't buying cars like they did 20 to 30 years ago. Only inexpensive, efficient, low-maintenance cars and luxury brands are selling well. Nissan is neither.",Negative,0,0,2025-02-04 03:13:35,IE,2,230,"Il y a trop de marques de voitures maintenant. L'économie est en train de s'effondrer, et les gens n'achètent pas de voitures comme ils l'ont fait il y a 20 à 30 ans. Seules les voitures bon marché, efficaces, peu d'entretien et les marques de luxe se vendent bien. Nissan n'est ni l'un ni l'un ni l'autre. . . . . . . . . . . . . . . . . . . . . . . . . . . . . . . . . . . . . . . . . . . . . . . . . . . . . . . . . . . . . . . . . . . . . . . . . . . . . . . . . . . . . . . . . . . . . . . . . . . . . . . . . . . . . . . . . . . . . . . . . . . . . . . . . . . . . . . . . . . . . . . . . . . . . . . . . . . . . . . . . . . . . . . . . . . . . . . . . . . . . . . . . . . . . . . . . . . . . . . . . . . . . . . . . . . . . . . . . . . . . . . . . . . . . . . . . . . . . . . . . . . . . . . . . . . . . . . . . . . . . . . . . . . . . . . . . . . . . . . . . . . . . . . . . . . . . . . . . . . . . . . . . . . . . . . . . . . . . . . . . . . . . . . . . . . . . . . . . . . . . . . . . . . . . . . . . . . . . . . . . . . . . . . . . . . . . . . . . . . . . . . . . . . . . . . . . . . . . . . . . . . . . . . . . . . . . . . . . . . . . . . . . . ."
Ugwva1md2FAYlKxoa094AaABAg_aug,qiVrICpvXF8,he took RABIES instead of steroids,AugmentedUser,AugmentedCID,"Honestly, only foolish individuals use steroids; the clever ones use undetectable viruses that can cause death or harm to others. Ok, so here's the question: When you get rabies, do you not have to get it treated by a doctor, which is detectable due to medical records?",Negative,0,0,2025-02-03 15:58:29,AU,24,269,"Honnêtement, seules les personnes stupides utilisent des stéroïdes; les personnes intelligentes utilisent des virus indétectables qui peuvent causer la mort ou nuire à d'autres. Ok, alors voici la question: Quand vous obtenez la rage, n'avez-vous pas à obtenir un traitement par un médecin, qui est détectable en raison des dossiers médicaux?"
UgxIId-xZMJD_-suVrh4AaABAg,myPFXZPNidg,I didn't Think This Was Possible (@driving_lessons),@thetwindragons-jw9uy,UCGX7ZdWOa7Q0EIeZpSY8BNA,Master at work!,Positive,0,0,2025-01-09 19:13:46,US,2,15,Maître au travail !
UgymJL9kWwyxNLgLgPB4AaABAg_aug,o_m59nMWny4,It's Official - GPT-3 Is Replacing Programmers...,AugmentedUser,AugmentedCID,"It's quite evident that the entry-level requirements for programmers are continuously increasing, disadvantaging a larger segment of people.",Negative,0,0,2025-02-02 14:45:03,US,27,140,"Il est tout à fait évident que les exigences d'entrée de gamme pour les programmeurs ne cessent d'augmenter, désavantagéssant un plus grand nombre de personnes."
UgwSgImTDTrIaoPAB0x4AaABAg,AlsNteE8wwI,"With firefighters stretched thin, Altadena residents battle to save homes from flames #fire",@michaelalejandro3267,UCvs3HKgG0m40mf7_g1v9IaA,Good thing they’re paying the highest taxes in the country. What a joke.,Negative,0,0,2025-01-14 14:15:34,IE,25,72,Heureusement qu'ils paient les impôts les plus élevés du pays.
UgwBaz9rksRt7MNghMF4AaABAg,3EolAmWz9hc,"Deion Sanders: ""My PROUDEST NFL Moment will SHOCK YOU!"" 🏈🏆 #nfl #shorts #ncaa",@dhud707,UCzVYBIQTkRMb-3fCbbJBx-g,Oh he pushed to get Billy in the game to put a little sweat in on for his SB ring.,Neutral,0,0,2025-01-08 05:10:51,US,17,82,"Oh, il a poussé Billy dans le jeu pour mettre une petite sueur sur sa bague SB."
UgwoxfU4NOoPMPHN0JZ4AaABAg_aug,4cWkVbC2bNE,"Database Systems - Cornell University Course (SQL, NoSQL, Large-Scale Data Analysis)",AugmentedUser,AugmentedCID,Here's the course's playlist:,Neutral,0,0,2025-02-05 00:13:11,US,27,29,Voici la liste de lecture du cours :
UgwYmNkQ7LjrdEGzKfV4AaABAg,UNREX90YR_s,When your mom says no to a sleepover.. ❌😭 #relatablestories #comedy #funnymemes,@JAXSONYU-r1u,UCrE9uM1TZd5hxC_wEE4f9Ew,bro has a life time amount of stories,Positive,0,0,2025-01-10 23:49:25,AU,24,37,bro a un temps de vie quantité d'histoires
Ugys8MHiwu1v8s3vwQV4AaABAg,pzye-NpCQa4,Nancy Pelosi is a squirrel on drugs. #shorts,@alanw64,UCKaa73k7NfklioJ_PzsQk4w,Y’all are the best!! 😂🤣😆🤩🥳 Best commentary,Positive,1,0,2022-03-17 14:12:15,US,25,42,Tous sont les meilleurs !! - Le meilleur commentaire. - C'est le meilleur commentaire. - C'est le meilleur commentaire. - C'est le meilleur commentaire. - C'est le meilleur commentaire. - C'est le meilleur commentaire. - C'est le meilleur commentaire. - C'est le meilleur commentaire. - C'est le meilleur commentaire. - C'est le meilleur commentaire. - C'est le meilleur. - C'est le meilleur commentaire. - C'est le meilleur commentaire. - C'est le meilleur commentaire. - C'est le meilleur. - C'est le meilleur commentaire. - C'est le meilleur commentaire. - C'est le meilleur commentaire. - C'est le meilleur commentaire. - C'est le meilleur commentaire. - C'est le meilleur commentaire. - C'est le meilleur. - C'est le meilleur. - C'est le meilleur. - C'est le meilleur. - C'est le meilleur. - C'est le meilleur. - C'est le meilleur. - C'est le meilleur commentaire. - C'est le meilleur. - C'est le meilleur commentaire. - C'est le meilleur commentaire. - C'est le meilleur. - C'est le meilleur.
Ugx3GcilXy-IWvtRBS94AaABAg,OmQCU-3KPms,React Native Tutorial  #19 - React Navigation Setup,@bluevision4800,UCjOSBMYNI70KIHZR92xhLEg,I did not found the library you showed on the actual website but I installed by seeing your screen one i crate and folwed same liek what you have done It says could not resolve rectstacknavigator,Negative,0,0,2023-03-15 01:31:37,GB,27,195,"Je n'ai pas trouvé la bibliothèque que vous avez montrée sur le site web réel, mais j'ai installé en voyant votre écran un i crate et folded meme liek ce que vous avez fait Il dit ne pouvait pas résoudre rectstacknavigator"
Ugwi79zxX98a32mEAu14AaABAg,NXZ-0lrHqb4,‘The Five’: Trump’s AG pick smacks down Adam Schiff,@jimjones9239,UCsfiMy6tREt54isosS-FHUw,"Hirono is not really interested in Bondi's answer, she is a DEI ornament for the State of Hawaii. She has done ZERO for the Hawaiian people including the victims of the Maui fire. Pencil neck should be removed for lying during his tenure where he ""represented"" Glendale but lived in Maryland, where is the ethics committee on this.",Negative,132,7,2025-01-17 00:44:32,US,25,331,"Hirono ne s'intéresse pas vraiment à la réponse de Bondi, elle est un ornement de DEI pour l'État d'Hawaii. Elle a fait ZERO pour le peuple hawaïen, y compris les victimes du feu Maui. Pencil cou devrait être enlevé pour avoir menti pendant son mandat où il «représentait» Glendale mais vivait dans le Maryland, où est le comité d'éthique sur ce sujet., .. . . . . . . . . . . . . . . . . . . . . . . . . . . . . . . . . . . . . . . . . . . . . . . . . . . . . . . . . . . . . . . . . . . . . . . . . . . . . . . . . . . . . . . . . . . . . . . . . . . . . . . . . . . . . . . . . . . . . . . . . . . . . . . . . . . . . . . . . . . . . . . . . . . . . . . . . . . . . . . . . . . . . . . . . . . . . . . . . . . . . . . . . . . . . . . . . . . . . . . . . . . . . . . . . . . . . . . . . . . . . . . . . . . . . . . . . . . . . . . . . . . . . . . . . . . . . . . . . . . . . . . . . . . . . . . . . . . . . . . . . . . . . . . . . . . . . . . . . . . . . . . . . . . . . . . . . . . . . . . . . . . . . . . . . . . . . . . . . . . . . . . . . . . . . . . . . . . . . . . . . . . . . . . . . . . . . . . . . . . . . . . . . . . . . . . . . . . . . . . . . . . . . . . . . . ."
UgzlIG8DJaVVMQTIk9N4AaABAg,VPvVD8t02U8,Flutter Course for Beginners – 37-hour Cross Platform App Development Tutorial,@theGrit_music,UC-8mOL18vtub9o8GmlQ_g2Q,This must have taken you SO much time to put together.  Thank you.  It's a very helpful introduction indeed.  Greatly appreciated.,Positive,36,0,2022-09-27 10:19:04,US,27,130,Cela a dû vous prendre tellement de temps à mettre ensemble. Merci. C'est une introduction très utile en effet. Très apprécié.
Ugz1I0qImgNmjkf7liR4AaABAg,-ZP4cAT0n00,This dunk is astonishing🤩🔥 #nba #basketball #dunk #dunks #sports #highlights #astonishing #sub,@iandelgado7376,UCUHtFPlP6FkV3iDUnI8H6JQ,Air Gordon under both legs takes the trophy. He was robbed.!,Negative,0,0,2025-01-10 02:57:18,US,17,60,"Air Gordon, sous les deux jambes, prend le trophée, il a été braqué. ! ! ! ! ! ! ! ! ! ! ! ! ! ! ! ! ! ! ! ! ! ! ! ! ! ! ! ! ! ! ! ! ! ! ! ! ! ! ! ! ! ! ! ! ! ! ! ! ! ! ! ! ! ! ! ! ! ! ! ! ! ! ! ! ! ! ! ! ! ! ! ! ! ! ! ! ! ! ! ! ! ! ! ! ! ! ! ! ! ! ! ! ! ! ! ! ! ! ! ! ! ! ! ! ! ! ! ! ! ! ! ! ! ! ! ! ! ! ! ! ! ! ! ! ! ! ! ! ! ! ! ! ! ! ! ! ! ! ! ! ! ! ! ! ! ! ! ! ! ! ! ! ! ! ! ! ! ! ! ! ! ! ! ! ! ! ! ! ! ! ! ! ! ! ! ! ! ! ! ! ! ! ! ! ! ! ! ! ! ! ! ! ! ! ! ! ! ! ! ! ! ! ! ! ! ! ! ! ! ! ! ! ! ! ! ! ! ! ! ! ! ! ! ! ! ! ! ! ! ! ! ! ! ! ! ! ! ! ! ! ! ! ! ! ! ! ! ! ! ! ! ! ! ! ! ! ! ! ! ! ! ! ! ! ! ! ! ! ! ! ! ! ! ! ! ! ! ! ! ! ! ! ! ! ! ! ! ! ! ! ! ! ! ! ! ! ! ! ! ! ! ! ! ! ! ! ! ! ! ! ! ! ! ! ! ! ! ! ! ! ! ! ! ! ! ! ! ! ! ! ! ! ! ! ! ! ! ! ! ! ! ! ! ! ! ! ! ! ! ! ! ! ! ! ! ! ! ! ! ! ! ! ! ! ! ! ! ! ! ! ! ! ! ! ! ! ! ! ! ! ! ! ! ! ! ! ! ! ! ! ! ! ! ! ! ! ! ! ! ! ! ! ! ! ! ! ! ! ! ! ! ! ! ! ! ! ! ! ! ! ! ! ! ! ! ! ! ! ! ! ! ! ! ! ! ! ! ! ! ! ! ! ! ! ! ! ! ! ! ! ! ! ! ! ! ! ! ! ! ! ! ! ! ! ! ! ! ! ! ! ! ! ! ! ! ! ! ! ! ! ! ! ! ! ! ! ! ! ! ! !"
UgzG1AjqYwMj4H_qRwJ4AaABAg,u49MZH-FFa4,5 Top Skills to Learn in College,@mochikaushal6220,UCk1bYtyQhSFnu1xkJgkJyfQ,🎉🎉,Positive,0,0,2024-10-04 17:33:06,IN,27,2,* * * * * * * * * * * * * * * * * * * * * * * * * * * * * * * * * * * * * * * * * * * * * * * * * * * * * * * * * * * * * * * * * * * * * * * * * * * * * * * * * * * * * * * * * * * * * * * * * * * * * * * * * * * * * * * * * * * * * * * * * * * * * * * * * * * * * * * * * * * * * * * * * * * * * * * * * * * * * * * * * * * * * * * * * * * * * * * * * * * * * * * * * * * * * * * * * * * * * * * * * * * * * * * * * * * * * * * * * * * * * * * * * * * * * * * * * * * * * * * * * * * * * * * * * * * * * * * * * * * * * * * * * * * * * * * * * * * * * * * * * * * * * * * * * * * * * * * * * * * * * * * * * * * * * * * * * * * * * * * * * * * * * * * * * * * * * * * * * * * * * * * * * * * * * * * * * * * * * * * * * * * * * * * * * * * * * * * * * * * * * * * * * * * * * * * * * * * * * * * * * * * * * * * * * * * * * * * * * * * * * * * * * * * * * * * * * * * * * * * * * * * * * * * * * * * * * * * * * * * * * * * * * * * * * * * * * * * * * * * * * * * * * * * * * * * * * * * * * * * * * * * * * * * * * *
UgzsfFfyOLm5CUOS6md4AaABAg,KJysgk5uxLQ,Women Save This Snow Fox 🦊 | Heart Touching Moment |,@AgustinMendoza-l8n,UCTf0Wnj75T8TTT5V0hwFIpw,AI,Negative,0,0,2025-01-14 02:40:31,NZ,15,2,"Immunisation de l'organisme d'évaluation de l'impact sur l'environnement, y compris l'organisme d'évaluation de l'impact sur l'environnement et l'environnement, y compris l'organisme d'évaluation de l'impact sur l'environnement, y compris l'organisme d'évaluation de l'impact sur l'environnement, y compris l'organisme d'évaluation de l'impact sur l'environnement, y compris l'organisme d'évaluation de l'impact sur l'environnement, l'organisme d'évaluation de l'impact sur l'environnement, l'organisme d'évaluation de l'impact sur l'environnement, l'organisme d'évaluation de l'impact sur l'environnement, l'organisme d'évaluation de l'impact sur l'environnement, l'organisme d'évaluation de l'impact sur l'environnement, l'organisme d'évaluation de l'impact sur l'environnement, l'organisme d'évaluation de l'impact sur l'environnement, l'organisme d'évaluation de l'impact sur l'environnement, l'organisme d'évaluation de l'impact sur l'environnement,"
Ugxf-v8nZWoeNYLphQR4AaABAg,TqPzwenhMj0,#4 Python Tutorial for Beginners | Variables in Python,@s.sireesha5334,UCu6hccWkVeh1kcs0yezLTeg,"Superb explaination sir,and it is very easy to learn
Thank you so much for making this video 👌👌👌",Positive,5,0,2018-10-21 08:25:11,IN,27,96,"Superbe explication monsieur, et il est très facile d'apprendre Merci beaucoup d'avoir fait cette vidéo .. . . . . . . . . . . . . . . . . . . . . . . . . . . . . . . . . . . . . . . . . . . . . . . . . . . . . . . . . . . . . . . . . . . . . . . . . . . . . . . . . . . . . . . . . . . . . . . . . . . . . . . . . . . . . . . . . . . . . . . . . . . . . . . . . . . . . . . . . . . . . . . . . . . . . . . . . . . . . . . . . . . . . . . . . . . . . . . . . . . . . . . . . . . . . . . . . . . . . . . . . . . . . . . . . . . . . . . . . . . . . . . . . . . . . . . . . . . . . . . . . . . . . . . . . . . . . . . . . . . . . . . . . . . . . . . . . . . . . . . . . . . . . . . . . . . . . . . . . . . . . . . . . . . . . . . . . . . . . . . . . . . . . . . . . . . . . . . . . . . . . . . . . . . . . . . . . . . . . . . . . . . . . . . . . . . . . . . . . . . . . . . . . . . . . . . . . . . . . . . . . . . . . . . . . . . . . . . . . . . . . . . . . . . . . . . . . . . . . . . . . . . . . . . . . . . . . . . . . . . . . . . . . . . . . . . . . . . . . . . . . . . . . . . . ."
UgzMZ1SP8gFonZ5UgxR4AaABAg,sqkwHUyV-YY,Behind the Scenes of The Coding Train: How I Livestream,@hascheidl,UC-mNRKBAyQiC1-MtW_BjgcA,do you do all of this alone? :D Really impressive,Positive,2,0,2019-11-09 22:09:37,US,27,49,faites-vous tout cela seul ? :D Vraiment impressionnant
UgzRrg0NcHUiqQeyXWB4AaABAg,FGdavhP-SNM,Bernie Warns of Biden's BIG Weakness,@tbotwest,UC6BpakvZTl_Kwvp3WNTgtWA,Workers of the world unite; you have nothing to lose but your chains.  Union now. Union forever!,Positive,7,2,2020-03-07 23:18:19,US,25,96,Les travailleurs du monde s'unissent ; vous n'avez rien à perdre que vos chaînes. Union maintenant. Union pour toujours !
UgyeFs4GJvkY4UtU1Id4AaABAg_aug,OvorXXWRqpw,#whalerescue#fishingtrip#barnacles#wildlife#oceanlife#foryou#foryoupage#fyp,AugmentedUser,AugmentedCID,I'm feeling sad 😢,Negative,0,0,2025-02-03 14:59:53,AU,15,17,Je me sens triste.
